{
  "$schema": "../../../../.agents/schemas/audio_recipe.schema.json",
  "channel_slug": "template-channel",
  "input": "media/voiceover/raw_voice.mp3",
  "output": "media/voiceover/master_voice.mp3",
  "target_lufs": -14.0,
  "true_peak": -1.2,
  "sample_rate": 48000,
  "bitrate": "192k",
  "mix_bed": "media/soundtrack/bed.mp3",
  "bed_volume": 0.18,
  "ducking": true
}
